519	Hallo! he cried, "what a bad rocket!" and he threw him over the wall into the ditch.	2
520	There is neither society here, nor solitude.	1
521	Well, that is his loss, not mine, answered the Rocket.	8
522	埃及设防的城市里也流行饥荒，蝗虫是从大荒漠里出来的。	1
523	“你这下完全瞎了，”他说，“我就一直呆在你身边吧。” 	4
524	The Giant was very kind to all the children, yet he longed for his first little friend, and often spoke of him.	7
525	Now that you have the chance you had better avail yourself of it, for I am going back to Court almost immediately.	7
526	“我们当时过得多么幸福。”他们彼此诉说道。	1
527	The last item on the programme was a grand display of fireworks, to be let off exactly at midnight.	0
528	樵夫把她弄进自己家里，他老婆照料着她，等她从晕厥中醒过来，他们夫妇赶紧又给她吃又给她喝，让她安心呆着。	8
529	据说那个墓穴里还躺着一个人，死者是一个异常英俊美丽的青年，他的双手用绳子反绑着，胸部被捅了很多刀，衣服都被血染红了。	3
530	But the girl frowned.	5
531	快快离开这里，我们可受不了你和我们一起玩耍了。”他们一起把他赶出了花园。	5
532	I am sure that he has not often got such a chance of improving his mind.	4
533	我吃了很多苦才找到了你啊。”	1
534	“我有许多美丽的花儿，”他说，“可是孩子们才是所有花中最美丽的花朵啊。”	0
535	他顿时感到一阵巨大的恐惧，他跟织工说：“你在织什么样的长袍？”	3
536	My nerves are certainly very much shattered, and I require rest."	3
537	他于是走到水井旁，往下看去，瞧呀!他的脸果真像癞蛤蟆的脸，他的身上像蛭蛇一样长满了鳞片。	3
538	He was so small that he could not reach up to the branches of the tree, and he was wandering all round it, crying bitterly.	1
539	我要走遍天下去寻找她，不找到她决不罢休。”	7
540	“你在这幢房子里竟说出这样的话？”年轻的国王说，他大步走过主教,走上祭坛的台阶，站在耶稣像的前面。	6
541	Who art thou? said the Giant, and a strange awe fell on him, and he knelt before the little child.	3
542	他看见了什么呢?	7
543	You have talked the whole time yourself.	8
544	凡是陪他去留给他使用的那套房间的人，都经常提到他一看见为他准备的精美衣服和大量珠宝快活得脱口惊叫；提到他脱掉他那身粗糙的皮束，腰外衣和破旧的羊皮长袍时欣喜若狂的样子。	6
545	At last, however, the fire caught him.	8
546	死亡大笑起来，拿起一个杯子，放进一个水池里，疟疾就从杯子里站立起来。	8
547	“不死亡回答说，“你不给我一粒玉米，我就是不走。”	3
548	Indeed, I have always been of opinion that hard work is simply the refuge of people who have nothing whatever to do."	5
549	老头儿从缠头布上取下一块花绸布，蒙在星孩的眼睛上，推操着往前面走。	3
550	The King's son was going to be married, so there were general rejoicings.	0
551	印度一些设防的城市里流行饥荒，撤马尔罕的水塘耗干了。	1
552	那块黄金正在水塘的底上躺着呢。	6
553	他对所有的市民都主持公道，施与慈悲；他把那个邪恶的魔术师驱逐岀去，给那个樵夫和他老伴儿送去许多丰厚的礼物，并且对他们的孩子封官晋爵。	4
554	And the weaver looked at him angrily, and said, 'Why art thou watching me?	2
555	那女人没有理他,只是向炉火边靠近。	8
556	兔子跟他说：“你找的那块红金子就在你身后的那个岩洞里。	4
557	母亲啊，我过去给了你恨。	1
558	因为我不认自己的母亲,把她赶走，傲慢无礼，对她冷酷无情。	5
559	太阳落山时他只好朝家的方向走去，哭得伤心极了，因为他知道什么命运在等着他。	1
560	他回答说：“我母亲是一个要饭的,就和我一样，我很恶劣地对待过她，我求你让我进去，她也许会原谅我，要是她真的呆在这座城里的话。”	8
561	星孩一看她走了，心下欢喜，赶紧去找他可以一起玩耍的小伙伴去了。	0
562	你在这树林里找什么呢?”	6
563	Good-bye, cried the Fire-balloon, as he soared away, dropping tiny blue sparks.	0
564	但她不吃也不喝，只是对樵夫说:“你不是说这孩子是在树林里找到的吗?	6
565	It's quite clear that they love each other, said the little Page, "as clear as crystal!" and the King doubled his salary a second time.	0
566	What a curious shape you are!	6
567	My good creature, cried the Rocket in a very haughty tone of voice, "I see that you belong to the lower orders.	2
568	他一点儿也不可怜穷人，对瞎子、残疾人和有病有灾的人，一点儿也不知怜悯，反而朝他们扔石头，硬把他们往大路上赶，要他们到别的地方要饭吃。于是，除了不法之徒，别人不敢再到村里来讨吃讨喝。	5
569	“现在这是你们的花园了，小娃娃们，”巨人说他拿起了一把大斧头，把那堵墙砍倒了。	7
570	他们像蚂蚁一样集聚在岩岸边。	5
571	The next day the workmen came to put everything tidy.	8
572	我的山谷与你有什么关系，你非赖着不走？快走吧，别再到这里来。”	2
573	你和我们有什么关系？我们受苦与你有何相干？”	5
574	He was dressed in grey, and his breath was like ice.	1
575	星孩脸色通红，十分生气，在地上跺着脚，说：“你是谁，敢对我发问？	2
576	“不，”死亡说，“你不给我一粒玉米，我就不走。	3
577	One night there flew over the city a little Swallow.	8
578	你是老几，竟敢给上帝的世界带来痛苦？	2
579	他一回来就看见孩子们在花园里玩耍。	0
580	I knew I should create a great sensation, gasped the Rocket, and he went out.	0
581	他们一脸饥饿相，瘦弱的手哆嗦个不停。	1
582	It is so beautiful that I am sure it has a long Latin name"; and he leaned down and plucked it.	4
583	“那就跟我来吧，”兔子说，“我带你去找到它，我知道它藏在哪里，也知道为什么藏在那里。	7
584	Then the Spring came, and all over the country there were little blossoms and little birds. 	0
585	星孩跟他说：“我口袋里只有一块黄金，可我要是不把它带给我的主人，那他就会打我，把我当奴隶养。”	3
586	那女人听了这些话，大叫一声，晕了过去。	6
587	“你当时在他身上发现什么标志没有？”她大声问道，	8
588	有一次他们陷进了深雪坑,挣脱出来就像正在磨面的磨工那样子白了；有一次他们滑进了池水结冰的光滑冰面上，他们的柴火摔散了捆，他们只好把柴火捡起来，重捆在一起；又有一次他们以为迷了路，心下害怕得要命，因为他们知道雪对任何睡在它们怀里的人都毫不留情。	3
589	It may be so with you, he answered; "indeed, I have no doubt that it is, but with me it is different.	8
590	他瘫倒在草地上哭了起来，跟自己说：“这肯定是我罪孽深重造成的苦果啊。	1
591	你母亲没有住在这个城里。”	1
592	他对疆鼠说：“你能钻到地下去。快告诉我，我母亲在那里吗？”	7
593	他到处寻找，却总找不到魔术师说的那块白金，找啊找啊，从早上找到中午，从中午找到夕阳西下。	1
594	所以,放我走吧，我一定要再一次走遍全世界,尽管你们给我拿来这皇冠和权杖,可我不能久留此地啊。”	7
595	这时候城门旁正坐着一个麻风病人。	8
596	“哎呀！我的儿，”她哭叫道，“我走之前你不吻我吗？	1
597	“喔，天哪，你竟这般负情。”大学生气愤地说；他把那朵红玫瑰扔向大街,花儿正好掉进臭水沟,一辆马车的轮子从上面辗了过去。	2
598	雪往草地盖上了她那巨大的白色斗篷，霜把所有的树都涂上了银色。	0
599	星孩回答说：“我在寻找一块藏在这里的黄金，我要是找不到它，我的主人会打我，把我当奴隶使唤的。”	1
600	主教听了他的三个梦，眉头皱起来,说：“我的孩子，我是一个老人，已是花甲暮年，大千世界里发生过的许多恶行,我见得多了。	5
601	樵夫这时在附近一个木料场里砍木头，看见了星孩的所作所为，就跑过来训斥他说：“你真是铁石心肠，一点不知可怜人，这个可怜的女人究竟干了什么坏事惹了你，你这样对待他？”	2
602	接着冰雹停止了在头顶砰砰乱跳，北风不再呼呼吼叫,一股扑鼻的香气从开着的窗扉飘到了他跟前。	0
603	她的衣服破破烂烂，因为在粗粝的路上行走脚磨得血淋淋的，样子非常狼狈。	5
604	“我们的老板！”织工恶狠狠地大声说，	2
605	And when he came quite close his face grew red with anger, and he said, "Who hath dared to wound thee?"	2
606	He did not hate the Winter now, for he knew that it was merely the Spring asleep, and that the flowers were resting.	8
607	他在幻觉中看见自己站立于大教堂高高的祭坛上，身穿华贵的龙袍，他那孩童般的嘴角露出顽皮而持久的微笑,他那黑髏黯林地般的眼睛放射岀明亮的光芒。	0
608	他过去从来没有如此急切地,或说如此狂喜地感受到诸多美丽的东西的魔力和真谛。	0
609	他走得很近时，他的脸色因为生气变得通红，他说：“是谁竟敢伤害你？”	2
610	Bang! Bang! answered the Crackers, who were enjoying themselves immensely.	0
611	年轻的国王又低下他的头，祈祷，等完成他的祷告，他站了起来，转过身悲哀地看着他们。	1
612	Bang! Bang! Bang! went the gunpowder.	6
613	瞧这冷风一个劲儿往屋里刮，我都冻死了。”	3
614	所以我对你所干的事情不赞成，劝你掉转马头回宫,让自己脸上高兴起来，穿上那套适合国王身份的衣服，戴上那顶我将为你加冕的皇冠，拿起那根我将交付你手的珍珠权杖。	4
615	年轻的国王想开口说话，可是他的舌头好像粘在他的上顎上,嘴唇怎么也张不开。	3
616	热病踩过的草都纷纷枯萎了。	1
617	一天早上，巨人醒来躺在床上，这时他听见了一种美妙的乐曲。	0
618	那是十年前的今天吗？”	6
619	狮子伏击商队，吃掉骆驼。	3
620	Hallo! cried one of the boys, "look at this old stick! I wonder how it came here"; and he picked the rocket out of the ditch.	6
621	但是他们信任好心的圣马丁，他对所有的行人都悉心看护，因此他们认着别人的脚印往回走，走得精疲力竭，终于走到了森林的外围，看见在他们脚下的山谷远处，他们居住的村子灯光闪烁。	4
622	“别呀，”他大声说，笑起来，“我们何必不把这丑东西当奴隶卖了，他的身价还够一碗甜酒的钱吧。”	5
623	人群拥拥挤挤，到处都是，他迷了路，最后来到了一个大广场上，只见广场上有一座王宫。	7
624	街上突然传来一阵闹哄哄的喧嚣，那些宫廷大员来势汹汹闯了进来，他们手中的剑已出鞘，盾牌闪着金属的光泽，头上的冠羽摇来晃去。	3
625	他爱恋自己，夏天里微风不起水波不动时，他常常趴在神父果园的那口井旁，注视井下他自己那张脸的精妙之处，为从自己美貌中获得的愉悦而欢笑。	0
626	“要是你真的是我的生身母亲，”他说，“那你还是离去的好，别在这儿让我丢脸，你瞧我原以为我是某颗星星的孩子,而不是一个叫花子的孩子，像你和我说的那样。	2
627	He was very much annoyed that he could not get a word in.	2
628	They danced so beautifully that the tall white lilies peeped in at the window and watched them, and the great red poppies nodded their heads and beat time.	0
629	I suppose they are reserving me for some grand occasion, said the Rocket; "no doubt that is what it means," and he looked more supercilious than ever.	5
630	然后他又邀请北风与他们做伴，北风就赶来了。	0
631	No one in the whole world is so sensitive as I am, I am quite sure of that.	4
632	Suddenly, a sharp, dry cough was heard, and they all looked round.	6
633	The negroes chattered to each other, and began to quarrel over a string of bright beads. 	2
634	But the Roman Candle and the Bengal Light were quite indignant, and kept saying, "Humbug! humbug!" at the top of their voices.	2
635	老主教看见他身穿牧羊装进来，从教座上惊讶地站起来，赶过去迎住他，对他说：“孩子啊，这就是国王的行头吗？我用什么皇冠来给你加冕？我拿什么权杖递交你手中？今天一定是你的欢乐日，一定不该是你的屈辱日吧。”	6
636	那麻风病人看见他来了，站在大路中间，大声嚷叫起来，说：“快把那块红金子给我吧，要不我就死定了。	3
637	苍白的病恢恢的孩子们蜷缩在大梁上。	1
638	贪婪一看三分之一的人都死了，心痛得捶胸哭泣。	1
639	But when I think that they might lose their only son, I certainly am very much affected."	1
640	他欣喜若狂，一把抓住它，对兔子说："我为你效了点儿劳，你却成倍地补偿了我；我对你发了点儿善，你还我的有百倍之多啊。”	0
641	第二天,这樵夫把那件少见的金斗篷放进一只大箱子里，他老婆又取下孩子脖子上戴的琥珀链子，也放到大箱子里去了。	8
642	他早先去拜访他的朋友、康沃尔的吃人魔去了，和吃人魔一呆就是七年。	3
643	疟疾身后升起一股冷雾，一条条水蛇在她身旁乱跑。	3
644	And the trees were so glad to have the children back again that they had covered themselves with blossoms, and were waving their arms gently above the children's heads. 	0
645	黑人们彼此交谈着，开始为一串明晃晃的珠子争吵起来。	2
646	于是他赶紧跑过去，弯下腰用手去拿，原来是一件金丝织的斗篷，精巧地绣着许多星星，叠了许多折。	0
647	You certainly are! cried the Bengal Light.	6
648	A person who, because he has corns himself, always treads on other people's toes, answered the Roman Candle in a low whisper; and the Cracker nearly exploded with laughter.	0
649	She was like a white rose before, said a young Page to his neighbour, "but she is like a red rose now"; and the whole Court was delighted.	0
650	Really it is quite like a croak, and croaking is of course the most musical sound in the world.	0
651	“多么奇怪的现象，”鸟类学教授走过桥时说，	6
652	Boom! Boom! went the Roman Candle.	6
653	As for domesticity, it ages one rapidly, and distracts one's mind from higher things."	8
654	“没事的，这可是一个星孩，他回答说；随后他给她讲了发现这孩子的奇怪经过。	8
655	It is one of my greatest pleasures.	0
656	我要把那个可怜的小男孩儿抱到那棵树顶上去，然后我再把这围墙拆掉，让我的花园世世代代成为孩子们的游戏场。”	7
657	鸟儿落在树上，唱起悦耳的歌儿，孩子们不由得停下游戏聆听鸟儿们歌唱。	0
658	其实只是一只小红雀儿在窗外唱歌，但是因为他很久没有听见鸟儿在他的花园里唱歌，所以他觉得这是人世间最美丽的音乐。	0
659	OLD Stick! said the Rocket, "impossible! GOLD Stick, that is what he said.	6
660	樵夫和他老婆倒也没有少骂他，总是说：“我们对待你从来没有像你对待那些孤苦无助的人那样。	2
661	So at the end of the King's garden a great stand had been set up, and as soon as the Royal Pyrotechnist had put everything in its proper place, the fireworks began to talk to each other.	7
662	But his face was strangely pale, and as he fell upon the deck the blood gushed from his ears and nostrils. 	3
663	You had really better keep yourself dry, said the Fire-balloon.	4
664	一点不假，他真的是被猎人们非常偶然地发现的；当时他四肢裸露，手持笛子,跟在一群山羊后面；他是那个牧羊人一手拉扯大的，一直认为自己是牧羊人的儿子。	6
665	The only thing that sustains one through life is the consciousness of the immense inferiority of everybody else, and this is a feeling that I have always cultivated.	5
666	And the tree broke at once into blossom, and the birds came and sang on it, and the little boy stretched out his two arms and flung them round the Giant's neck, and kissed him.	0
667	一点不假，他有时会怀念起他在森林中无拘无束的生活，会又寸每天占去许多时间的宫廷繁礼缠节动辄大发脾气，但这令人入迷的宫殿--如人称所谓的“欢乐宫”------似乎是他寻欢觅乐的全新世界,他发现自己成了宫中的君王。	7
668	“我拿着三颗玉米粒，”她回答说,你问这干什么？”	6
669	“这颗明珠，”他说，“将镶嵌在年轻国王的权杖上。”他挥手示意黑人们起锚开船。	7
670	And the Giant stole up behind him and took him gently in his hand, and put him up into the tree.	4
671	他看见星孩来了，赶紧敲响一个木碗，揺起他的铃，向他呼求，说：“给我一点儿钱吧，要不我就饿死了。	1
672	但是他的小伙伴一见他走来，纷纷嘲笑他说：“喂，你像癞蛤蟆一样肮脏，像蛭蛇一样可恶啰。	5
673	I have many beautiful flowers, he said; "but the children are the most beautiful flowers of all."	0
674	There is no good talking to him, said a Dragon-fly, who was sitting on the top of a large brown bulrush; "no good at all, for he has gone away."	6
675	但是谁都不敢看他的脸，只因他的脸像天使的圣容。	4
676	It sounded so sweet to his ears that he thought it must be the King's musicians passing by.	0
677	这欧洲北部的天气真是吓人。	3
678	一个冬天的早上，他一边穿衣服一边看着窗外。	8
679	他觉得他躺在一艘大帆船的甲板上,一百名奴隶在挥桨划水。	7
680	It is a very dangerous thing to know one's friends.	3
681	谁是你的老板？〃年轻的国王问道。	7
682	宫廷大臣对年轻的国王说：“陛下,我恳求你把你这些不吉利的念头统统打消掉，快把这件漂亮的皇袍穿上，把这顶皇冠戴在头上吧。	7
683	You are blind now, he said, "so I will stay with you always."	4
684	Oh! dear no, cried the Rocket.	6
685	So the Hail came. 	8
686	他再也玩儿不动了，只好坐在他的大扶手椅子里，看孩子们玩儿游戏，观赏他自己的花园。	0
687	After some time a large White Duck swam up to him.	6
688	早上起来时，他从树上采摘了一些苦涩的浆果充饥，又向大森林出发，哭得伤心极了。	1
689	随后他用那块花绸巾蒙上星孩的眼睛，领着他穿过房子和罂粟花园,走上那五级铜台阶。	8
690	How very silly of him not to stay here! said the Rocket.	2
691	“你们在这里干什么？”他喊叫道,声音很霸道，孩子们赶紧跑散了。	2
692	我怎么能飞起来呢？	8
693	“不必多提，毕竟是你首先心疼我的呀。”兔子说，它转眼就跑走了。	4
694	过了一会儿，他们离开了屋子,他入睡了。	8
695	I believe the Spring has come at last, said the Giant; and he jumped out of bed and looked out.	7
696	In fact, it was only yesterday that I heard the farmer's wife say to her mother that she could not get a wink of sleep at night on account of us.	8
697	I often have long conversations all by myself, and I am so clever that sometimes I don't understand a single word of what I am saying.	0
698	北风用皮外衣裹得严严实实，整天都在花园里呜呜叫个不停,把烟囱都刮倒了。	1
699	But they took no notice of him at all till they were just going away.	6
700	唯一欢迎这大冷天的好像只有大角猫头鹰。	0
701	他们来去匆匆，互相呼喊，没有人闲着。	8
702	“这位穿戴得像一个乞丐的国王在哪里------就是给我们王国带来耻辱的男孩儿？我们一定要杀了他,他根本不配统治我们。”	2
703	尼罗河没有泛滥，祭士们都在诅咒伊西斯回和奥西里斯図。	1
704	然而，他统治的时候不长，因为他过去遭受苦难太多，考验他的烈火太猛，他仅仅活了三年就死去了。	1
705	“你们一定告诉他务必明天来这里玩儿。”巨人说。	7
706	然而贪婪攥紧手，咬紧牙关。	4
707	我怎么能知道呢？”	8
708	But the Roman Candle and the Bengal Light were quite indignant, and kept saying, "Humbug! humbug!" at the top of their voices.	2
709	When the three days were over the marriage was celebrated.	0
710	鸟儿们到处飞动，高兴得叽叽喳喳鸣叫，花儿从绿草地往上张望，喜笑颜开。	0
711	咸涩的浪花在桨叶中翻飞。	1
712	Good heavens! cried the Goose.	6
713	And he certainly did explode.	6
714	树们非常高兴孩子们又回来了，便开满了花儿，在孩子们的头上轻轻地摇动起他们的枝杈。	0
715	Do you think it will be a wet afternoon?	7
716	但是正在他们互相哀叹他们的痛苦时，一件怪事发生了。	6
717	She had yellow legs, and webbed feet, and was considered a great beauty on account of her waddle.	4
718	巨人看着这幕景致，心融化了。	1
719	但是他的伙伴回答他说：“不，把一个小娃娃扔在雪地里冻死在这儿，这是作孽啊；尽管我像你一样穷苦，拉家带口,连锅都揭不开了，可是我却要把他带回家,我老婆会照管他的。”	4
720	他不准许任何人虐待鸟儿和野兽，而是教人懂得爱、亲情和仁慈；他向穷人发放面包，向衣不蔽体的人发放衣服，在他的国土上，到处一片祥和富足的景象。	4
721	两只苍鹭在船周围飞来飞去。	3
722	Every one was a great success except the Remarkable Rocket.	6
723	他高兴得大叫起来，跑了过去，跪下来亲吻他母亲脚上的伤口，眼泪都把伤口打湿了。	0
724	What a curious thing! he cried; "there is not a single cloud in the sky, the stars are quite clear and bright, and yet it is raining.	6
725	宫廷大臣和朝廷高官纷纷来向他跪拜称臣，侍从们给他送上金丝袍，把皇冠和权杖摆在他面前。	7
726	I am laughing because I am happy, replied the Cracker.	0
727	大银耳环垂在他那厚厚的耳垂上，每只手里拿着一只银白色的天平。	0
728	但他的心情却十分沉重，因为他知道什么厄运在等着他。	1
729	”他把所有朝臣都打发走，就留下一个留在身边作伴儿的侍从，一个比他还小一岁的小伙子。	8
730	星孩拿上那块黄金，把黄金装进了袋子，急匆匆往城里赶去。	7
731	你们怎么能说我生得美丽呢？	6
732	Delightful! he cried, "I shall go on like this for ever. 	0
733	星孩把他们领到哪里，他们就跟到哪里，星孩叫他们干什么，他们就干什么。	7
734	小男孩儿对巨人微笑着跟他说：“你曾经让我在你的花园里玩耍过，今天你跟我到我的花园去吧，那是天堂。”	0
735	我们整天为他们卖苦力，他们在金库里堆砌金子，我们的孩子们过早夭折了，我们热爰的那些人的脸变得冷酷而邪恶。	2
736	I hate rudeness and bad manners of every kind, for I am extremely sensitive.	5
737	“我身穿痛苦铸就的衣冠，能高兴起来吗？”年轻的国王说。	1
738	However, I excuse your ignorance.	4
739	红雀儿回答说：“你图一时快活，把我的翅膀剪掉了。	2
740	The eyes of the Happy Prince were filled with tears, and tears were running down his golden cheeks.	1
741	但是，天哪！斗篷里面没有金子，也没有银子，当然也没有什么宝贝，只有一个小孩儿睡在里面。	6
742	最后他对她开了口，话语又生硬又刻薄。	2
743	一抹淡淡的茉莉花香从敞开的窗子飘了进来。	0
744	桌子上放着一只扁平的紫晶盒。	8
745	死亡对她说：“你手里拿着什么？”	8
746	但是那个巨人深爱的小男孩儿再也没有露面。	1
747	 “我什么都不会送给你的。”贪婪说。	1
748	人们笑起来，说：“刚刚骑马过去的是国王的弄臣吗？”他们取笑他。	6
749	她走得疲惫不堪，就在一棵栗子树下坐下来休息。	1
750	“别这样，上帝连麻雀都关心，给它们吃的呢。”他回答说。	4
751	I am merely a visitor, a distinguished visitor.	8
752	”他气得满脸通红，对他们说：“我就是国王。”他把他们的矛戟挡到一边，闯了进去。	2
753	然而星孩呆在原地一动不动，对她完全关上了心扉，除了那女人痛苦的哭泣声外，别的什么也没听到。	1
754	那个老神父也经常找他去，尽心尽力教他热爱有生命的东西，并对他说：“蝇子是你的兄弟。	4
755	他疲乏地爬下绳梯，消失在海中。	1
756	As they passed the column he looked up at the statue: "Dear me! how shabby the Happy Prince looks!" he said.	6
757	“大地就要喜结良缘了，这是她的婚礼服。”斑鸠彼此小声交谈说。	0
758	Ah! the higher things of life, how fine they are! said the Duck; "and that reminds me how hungry I feel": and she swam away down the stream, saying, "Quack, quack, quack."	0
759	每天下午，孩子们从学校出来后，都往往到巨人的花园去玩耍。	0
760	那麻风病人也把手放在他头上，对他说：“起来吧。”	7
761	The sledge was shaped like a great golden swan, and between the swan's wings lay the little Princess herself.	0
762	He saw a most wonderful sight. 	6
763	他把红金子装进他的袋子，急忙朝城里赶去。	7
